{
    "$schema": "http://json-schema.org/draft-07/schema#",
    "type": "object",
    "properties": {
        "SamplesAnalysisID": {
            "type": "string",
            "pattern": "^[\\w\\-\\.]+:work-product-component\\-\\-SamplesAnalysis:[\\w\\-\\.\\:\\%]+:[0-9]*$"
        },
        "SamplesID": {
            "type": "string",
            "pattern": "^[\\w-.]+:master-data-Samples:[\\w\\-\\.\\:\\%]+:[0-9]*$"
        },
        "BrineConcentration": {
            "type": "object",
            "properties": {
                "Value": {
                    "type": "number"
                },
                "UnitOfMeasure": {
                    "type": "string",
                    "pattern": "^[\\w-.]:reference-data--UnitOfMeasure:[\\w\\-\\.\\:\\%]+:[0-9]*$"
                }
            }
        },
        "FormationFactor": {
            "type": "number"
        },
        "AdjustedFormationFactor": {
            "type": "number"
        },
        "CementationExponent": {
            "type": "number"
        },
        "AdjustedCemetationExponent": {
            "type": "number"
        },
        "SaturationExponent": {
            "type": "number"
        },
        "AdjustedSaturationExponent": {
            "type": "number"
        }
    },
    "required": [
        "SamplesAnalysisID",
        "SamplesID"
    ]
}
